{
        "langvalue" : "it",
        "langname" : "Italian" ,
        "table" : "Tabella",
        "scan" : "Conteggio analisi ",
        "logical" : "letture logiche ",
        "physical" : "letture fisiche ",
        "readahead" : "letture read-ahead ",
        "loblogical" : "letture logiche LOB ",
        "lobphysical" : "letture fisiche LOB ",
        "lobreadahead" : "letture LOB read-ahead ",
        "headerrownum" : "Riga",
        "headertable" : "Tabella",
        "headerscan" : "Conteggio analisi",
        "headerlogical" : "Letture logiche",
        "headerphysical" : "Letture fisiche",
        "headerreadahead" : "Letture read-ahead",
        "headerloblogical" : "Letture logiche LOB",
        "headerlobphysical" : "Letture fisiche LOB",
        "headerlobreadahead" : "Letture LOB read-ahead",
        "headerperlogicalread" : "% Letture logiche sul totale",
        "executiontime" : "Tempo di esecuzione SQL Server:",
        "compiletime" : "Tempo di analisi e compilazione SQL Server:",
        "cputime" : "tempo di CPU = ",
        "elapsedtime" : "tempo trascorso = ",
        "elapsedlabel" : "Tempo trascorso",
        "cpulabel" : "CPU",
        "milliseconds" : "ms",
        "rowsaffected" : "righe interessate" ,
        "headerrowsaffected" : " righe interessate",
        "headerrowaffected" : " riga interessata",
        "errormsg" : "Mes",
        "sampleoutput" : "Tempo di analisi e compilazione SQL Server: \r\n   tempo di CPU = 0 ms, tempo trascorso = 0 ms.\r\n\r\n(25499 righe interessate)\r\nTabella \u0027Workfile\u0027. Conteggio analisi 0, letture logiche 0, letture fisiche 0, letture server di pagine 0, letture read-ahead 0, letture read-ahead server di pagine 0, letture logiche LOB 0, letture fisiche LOB 0, letture LOB server di pagine 0, letture LOB read-ahead 0, letture read-ahead LOB server di pagine 0.\r\nTabella \u0027Worktable\u0027. Conteggio analisi 0, letture logiche 0, letture fisiche 0, letture server di pagine 0, letture read-ahead 856, letture read-ahead server di pagine 0, letture logiche LOB 0, letture fisiche LOB 0, letture LOB server di pagine 0, letture LOB read-ahead 0, letture read-ahead LOB server di pagine 0.\r\nTabella \u0027FATRIG\u0027. Conteggio analisi 1, letture logiche 13563, letture fisiche 0, letture server di pagine 0, letture read-ahead 0, letture read-ahead server di pagine 0, letture logiche LOB 0, letture fisiche LOB 0, letture LOB server di pagine 0, letture LOB read-ahead 0, letture read-ahead LOB server di pagine 0.\r\nTabella \u0027FATTES\u0027. Conteggio analisi 1, letture logiche 3748, letture fisiche 0, letture server di pagine 0, letture read-ahead 0, letture read-ahead server di pagine 0, letture logiche LOB 0, letture fisiche LOB 0, letture LOB server di pagine 0, letture LOB read-ahead 0, letture read-ahead LOB server di pagine 0.\r\nTabella \u0027COMRIG\u0027. Conteggio analisi 1, letture logiche 170, letture fisiche 0, letture server di pagine 0, letture read-ahead 0, letture read-ahead server di pagine 0, letture logiche LOB 0, letture fisiche LOB 0, letture LOB server di pagine 0, letture LOB read-ahead 0, letture read-ahead LOB server di pagine 0.\r\nTabella \u0027CONTI\u0027. Conteggio analisi 1, letture logiche 224, letture fisiche 0, letture server di pagine 0, letture read-ahead 0, letture read-ahead server di pagine 0, letture logiche LOB 0, letture fisiche LOB 0, letture LOB server di pagine 0, letture LOB read-ahead 0, letture read-ahead LOB server di pagine 0.\r\nTabella \u0027TIPIDOC\u0027. Conteggio analisi 2, letture logiche 8, letture fisiche 0, letture server di pagine 0, letture read-ahead 0, letture read-ahead server di pagine 0, letture logiche LOB 0, letture fisiche LOB 0, letture LOB server di pagine 0, letture LOB read-ahead 0, letture read-ahea LOB server di pagine 0.\r\nTabella \u0027COMTES\u0027. Conteggio analisi 1, letture logiche 1702, letture fisiche 0, letture server di pagine 0, letture read-ahead 0, letture read-ahead server di pagine 0, letture logiche LOB 0, letture fisiche LOB 0, letture LOB server di pagine 0, letture LOB read-ahead 0, letture read-ahead LOB server di pagine 0.\r\nTabella \u0027CLIENTI\u0027. Conteggio analisi 2, letture logiche 20, letture fisiche 0, letture server di pagine 0, letture read-ahead 0, letture read-ahead server di pagine 0, letture logiche LOB 0, letture fisiche LOB 0, letture LOB server di pagine 0, letture LOB read-ahead 0, letture read-ahead LOB server di pagine 0.\r\nTabella \u0027PERSONE\u0027. Conteggio analisi 4, letture logiche 794, letture fisiche 0, letture server di pagine 0, letture read-ahead 0, letture read-ahead server di pagine 0, letture logiche LOB 0, letture fisiche LOB 0, letture LOB server di pagine 0, letture LOB read-ahead 0, letture read-ahead LOB server di pagine 0.\r\nTabella \u0027ANAPAG\u0027. Conteggio analisi 1, letture logiche 5, letture fisiche 0, letture server di pagine 0, letture read-ahead 0, letture read-ahead server di pagine 0, letture logiche LOB 0, letture fisiche LOB 0, letture LOB server di pagine 0, letture LOB read-ahead 0, letture read-ahead LOB server di pagine 0.\r\nTabella \u0027NAZIONI\u0027. Conteggio analisi 1, letture logiche 2, letture fisiche 0, letture server di pagine 0, letture read-ahead 0, letture read-ahead server di pagine 0, letture logiche LOB 0, letture fisiche LOB 0, letture LOB server di pagine 0, letture LOB read-ahead 0, letture read-ahead LOB server di pagine 0.\r\nTabella \u0027AGENTI\u0027. Conteggio analisi 2, letture logiche 4, letture fisiche 0, letture server di pagine 0, letture read-ahead 0, letture read-ahead server di pagine 0, letture logiche LOB 0, letture fisiche LOB 0, letture LOB server di pagine 0, letture LOB read-ahead 0, letture read-ahead LOB server di pagine 0.\r\nTabella \u0027LOTSER\u0027. Conteggio analisi 1, letture logiche 18, letture fisiche 0, letture server di pagine 0, letture read-ahead 0, letture read-ahead server di pagine 0, letture logiche LOB 0, letture fisiche LOB 0, letture LOB server di pagine 0, letture LOB read-ahead 0, letture read-ahead LOB server di pagine 0.\r\nTabella \u0027ARTICO\u0027. Conteggio analisi 1, letture logiche 370, letture fisiche 0, letture server di pagine 0, letture read-ahead 0, letture read-ahead server di pagine 0, letture logiche LOB 0, letture fisiche LOB 0, letture LOB server di pagine 0, letture LOB read-ahead 0, letture read-ahead LOB server di pagine 0.\r\nTabella \u0027CLASSI\u0027. Conteggio analisi 1, letture logiche 2, letture fisiche 0, letture server di pagine 0, letture read-ahead 0, letture read-ahead server di pagine 0, letture logiche LOB 0, letture fisiche LOB 0, letture LOB server di pagine 0, letture LOB read-ahead 0, letture read-ahead LOB server di pagine 0.\r\nTabella \u0027CATOMO\u0027. Conteggio analisi 1, letture logiche 2, letture fisiche 0, letture server di pagine 0, letture read-ahead 0, letture read-ahead server di pagine 0, letture logiche LOB 0, letture fisiche LOB 0, letture LOB server di pagine 0, letture LOB read-ahead 0, letture read-ahead LOB server di pagine 0.\r\nTabella \u0027GRUPPI\u0027. Conteggio analisi 1, letture logiche 2, letture fisiche 0, letture server di pagine 0, letture read-ahead 0, letture read-ahead server di pagine 0, letture logiche LOB 0, letture fisiche LOB 0, letture LOB server di pagine 0, letture LOB read-ahead 0, letture read-ahead LOB server di pagine 0.\r\nTabella \u0027LINEEP\u0027. Conteggio analisi 1, letture logiche 2, letture fisiche 0, letture server di pagine 0, letture read-ahead 0, letture read-ahead server di pagine 0, letture logiche LOB 0, letture fisiche LOB 0, letture LOB server di pagine 0, letture LOB read-ahead 0, letture read-ahead LOB server di pagine 0.\r\nTabella \u0027MARCHE\u0027. Conteggio analisi 1, letture logiche 4, letture fisiche 0, letture server di pagine 0, letture read-ahead 0, letture read-ahead server di pagine 0, letture logiche LOB 0, letture fisiche LOB 0, letture LOB server di pagine 0, letture LOB read-ahead 0, letture read-ahead LOB server di pagine 0.\r\n\r\nTempo di esecuzione SQL Server: \r\n tempo di CPU = 657 ms, tempo trascorso = 944 ms.\r\n\r\nMessaggio 207, livello 16, stato 1, riga 1\r\nIl nome di colonna \u0027test\u0027 non Ã¨ valido.\r\n"
}


